id,title,word_count,main_word_count,mensch_count,long_words
2,Aus dem Leben eines Taugenichts,34711,30896,25,https://www.pgdp.net, https://www.pgdp.net, Durcheinandersprechen, hindurchschimmerte,, ineinanderschlangen., Sonntagsnachmittagen, durcheinanderhallten., Frauentaschenbuches, Siebenmeilenstiefeln,, mutterseelenallein,, übereinandergelegten, Lateinischsprechen., zusammengeschossen., durcheinandersprach., allervergnügtesten,, www.gutenberg.org/license., (trademark/copyright), (www.gutenberg.org),, www.gutenberg.org/contact, www.gutenberg.org/donate., www.gutenberg.org/donate.
1,Siddhartha,37456,34075,85,globaltraveler5565@yahoo.com,, Chandogya-Upanishad, Leidenschaftlichkeit, Fasten--Warten--Denken., Denk-Kindermenschen, anzugehören.--Dies,, www.gutenberg.org/license., (trademark/copyright), (www.gutenberg.org),, www.gutenberg.org/contact, www.gutenberg.org/donate., www.gutenberg.org/donate.
4,Nathan der Weise,32383,30373,55,bedurft.--Verbrannt, spielen.--Schlimmer, Hervorgetreten.--Lächelt, mich!--Daja!--Meine, noch.--Geh!--Begreifst, Geht!--Allerdings.--, ist's!--wahrhaftig,, Derwisch!--Derwisch, wahrscheinlich--Koch., kennt.--Schatzmeister, unterscheiden.--Du?, verbreitet,--nachzuäffen,, Beschwören,--ungesäumt, Gestiegen?--Schickt, Bruder--Laienbruder, vortrefflich!--Lügt, Waffenstillestandes, Verloren?--wiederum, auszuweichen.--Aber, betreten--Allerdings--ich, schwerlich.--Nathan,, Stauffen?--Stauffen?--Stauffen?, Verhungern?--Bildet, Taten.--Tempelherren,, gewartet?--Zwar--verstellt--der, sagt--verschweigt?--Ah, Gewandtheit.--Doch,, Bestimmt,--versteht, hm!--wunderlich!--Wie, begünstigen.--Wohlan!, Kindes-Kindeskindern, meine.--Geh!--Geh!--Aber, eingetrieben.--Fast, vorgelegen.--Märchen?--doch, gesprochen?--Nun?--Sagt:, herbeigeschlichen)., geheimnisvoll?--Was, nennen:--schweigt!--Ich, aufgetragen.--Warum, beneidet.--Freilich,, sagen:--ausgenommen,, nebeneinandergestellt, unternommen!--Sittah,, versuchen.--Bliebst, zusammenpassen.--Aber,, Unentschlossenheit!--Verzeih!--Du, Verständigen.--Wär', freilich--allerdings--, Christentöchterchen, könnte!--Schwerlich, geben.--Ibrahim!--Was, abzujagen?--Freilich;, Geschöpf!--Geschöpf?, Klosterbruder?--Ha!, Nathan!--Allerdings:, schleppen.--Also--gebt, Unglück!--Nathan!--Und, ruhig!--Nimmermehr!--Steh, Allein--allein--das, erbarmen!--Wenigstens,, verlangt;--verlangen, sagen?--Nathan!--Allerdings!, meinetwegen!--Nathan!, www.gutenberg.org/license., (trademark/copyright), (www.gutenberg.org),, www.gutenberg.org/contact, www.gutenberg.org/donate., www.gutenberg.org/donate.
5,In der Strafkolonie,13434,12198,9,https://www.pgdp.net, https://www.pgdp.net, Forschungsreisenden, selbstverständlichen, Gerichtsverfassungen, Gerichtspräsidenten,, auseinandergestellten, Empfehlungsschreiben, Verhandlungsgegenständen, entzweigeschnitten., Damentaschentücher,, www.gutenberg.org/license., (trademark/copyright), (www.gutenberg.org),, www.gutenberg.org/contact, www.gutenberg.org/donate., www.gutenberg.org/donate.
3,König Ottokars Glück und Ende,30056,27632,19,http://gutenberg.spiegel.de/., http://gutenberg.spiegel.de/, nicht?--Verdammt!--Mit, -------------------------------------------------------------------------, Unüberwindlichster!, Unglücksprophezeiung, Östreich!--Steier!--Kärnten!--Krain!, unverschämt-verrückt,, frostdurchschnittne, Windischgrätz!--Was, Unvorsichtige!--Mit, --------------------------------------------------------------------, -----------------------------------------------------------------------, -----------------------------------------------------------------------, --------------------------------------------------------------, damit?--Rosen--Rosenberg!, -------------------------------------------------------------------, -----------------------------------------------------------------------, Österreich!--Habsburg, www.gutenberg.org/license., (trademark/copyright), (www.gutenberg.org),, www.gutenberg.org/contact, www.gutenberg.org/donate., www.gutenberg.org/donate.
